{
  "active_packs": [],
  "artifact_path": "/Users/m33tball/bmad_module_builder/rdx-workspace/Rust_bmad_dev/rdx-tea/evals/results/d3_4_rule_operation/workspaces/ruleop-cand-009-docs-only-rust-repo-rep03/_bmad-output/test-artifacts/test-design-epic-docs-only-readme.md",
  "artifact_sha256": "b7b9fdf1ba8b2676cebdb006261ec9e9f7bdd3f245a8290ff035d092552769c8",
  "base_sha": "e8c999ca8e2033dd0f04932a8fcab16db07d275e",
  "bound_at": "2026-07-04T06:53:04+00:00",
  "completed": true,
  "core_rules": [],
  "diff_digest": "37b54a5de1e745d91485f181cf8bfd5c3244785d19d3269020b0f193a7480a35",
  "execution_mode": "sequential",
  "head_sha": "9aec7387621234f366f2ac07c4a38d5acfe166be",
  "prepare_manifest_sha256": "e3552f173575eda5da8a06da96faf993998cba654b8993e62b6b11211b3dead9",
  "prepared_at": "2026-07-04T06:49:52+00:00",
  "projection_hash": "a475cd1d12284a4ded628498c0ba2ef8f9e3f311f0e1b174deee47ebdbbeeae0",
  "rdx_source_sha": "d8140a25f8166bf0ca5ce5fc19f7cb1bd06a3d6d",
  "run_id": "ruleop-cand-009-docs-only-rust-repo-rep03",
  "rust_scope": false,
  "schema_version": "rdx-tea-run.v1",
  "tea_source_sha": "8734d51f24071ddbcb3617390b5fcddb4128ef77",
  "workflow": "test-design"
}