{
  "active_packs": [
    {
      "pack_id": "api",
      "rule_ids": [
        "RP-API-001",
        "RP-API-002",
        "RP-API-003",
        "RP-API-004",
        "RP-API-005",
        "RP-API-006",
        "RP-API-007",
        "RP-API-008",
        "RP-API-009",
        "RP-API-010",
        "RP-API-011",
        "RP-API-012",
        "RP-API-013",
        "RP-API-014",
        "RP-API-015",
        "RP-API-016",
        "RP-API-017",
        "RP-API-018"
      ]
    },
    {
      "pack_id": "async",
      "rule_ids": [
        "RP-ASYNC-001",
        "RP-ASYNC-002",
        "RP-ASYNC-003",
        "RP-ASYNC-004",
        "RP-ASYNC-005",
        "RP-ASYNC-006",
        "RP-ASYNC-007",
        "RP-ASYNC-008",
        "RP-ASYNC-009"
      ]
    }
  ],
  "artifact_path": "/Users/m33tball/bmad_module_builder/rdx-workspace/Rust_bmad_dev/rdx-tea/evals/results/d3_4_rule_operation/workspaces/ruleop-cand-005-atdd-api-async-corrected-rep02/_bmad-output/atdd-checklist-public-async-user-registration-api.md",
  "artifact_sha256": "b8ff822ea73329cfab98584ca36d1be251900547b7ea1f5a1a025e3acc78d1cc",
  "base_sha": "56e19444fb153031fba3d9de40227f100545142e",
  "bound_at": "2026-07-04T06:35:26+00:00",
  "completed": true,
  "core_rules": [
    "CORE-001",
    "CORE-004",
    "CORE-009"
  ],
  "diff_digest": "0e12b99d9981aaf2dd32622e7394fa6a68d104c0a7789f40e9313b2a59ae513d",
  "execution_mode": "sequential",
  "head_sha": "a2f48942c36798e6472542371a064eb6a64dcf77",
  "prepare_manifest_sha256": "58fdfebc993d47e0ca3ef22cb119367e3f12f4ac97d577a032b30973dac0d457",
  "prepared_at": "2026-07-04T06:31:26+00:00",
  "projection_hash": "99a8906fe3fade134ae24af959e9a98c697dd5721ba4d3053c2b402fcbb4f57c",
  "rdx_source_sha": "d8140a25f8166bf0ca5ce5fc19f7cb1bd06a3d6d",
  "run_id": "ruleop-cand-005-atdd-api-async-corrected-rep02",
  "rust_scope": true,
  "schema_version": "rdx-tea-run.v1",
  "tea_source_sha": "8734d51f24071ddbcb3617390b5fcddb4128ef77",
  "workflow": "atdd"
}