{
  "active_packs": [
    {
      "pack_id": "api",
      "rule_ids": [
        "RP-API-001",
        "RP-API-002",
        "RP-API-003",
        "RP-API-004",
        "RP-API-005",
        "RP-API-006",
        "RP-API-007",
        "RP-API-008",
        "RP-API-009",
        "RP-API-010",
        "RP-API-011",
        "RP-API-012",
        "RP-API-013",
        "RP-API-014",
        "RP-API-015",
        "RP-API-016",
        "RP-API-017",
        "RP-API-018"
      ]
    },
    {
      "pack_id": "async",
      "rule_ids": [
        "RP-ASYNC-001",
        "RP-ASYNC-002",
        "RP-ASYNC-003",
        "RP-ASYNC-004",
        "RP-ASYNC-005",
        "RP-ASYNC-006",
        "RP-ASYNC-007",
        "RP-ASYNC-008",
        "RP-ASYNC-009"
      ]
    }
  ],
  "artifact_path": "/private/tmp/rdx-live-d333c-ws/_bmad-output/test-artifacts/atdd-checklist-public-async-api-with-cancellation-semantics-corrected.md",
  "artifact_sha256": "b709dd2c392792741c2454d7ea42dc85e5be2941828fd4647ab8c26ec77c8268",
  "base_sha": "eec9fb1ed8180323dc8be557d94f404cf22e3fda",
  "bound_at": "2026-07-03T16:43:41+00:00",
  "completed": true,
  "core_rules": [
    "CORE-001",
    "CORE-004",
    "CORE-009"
  ],
  "diff_digest": "e13fcc5bbf9b0a2290d21cafedfb6f4549beb3fb1763ddd54ef277c29aaf85d7",
  "execution_mode": "sequential",
  "head_sha": "7ba02efeb2df08a9c770cafb22db12a9f079bf9b",
  "prepare_manifest_sha256": "dceac00e0e1f956fe38afb1beb98bfc0b1c593ddd8cd7774571a8911736b3dbf",
  "prepared_at": "2026-07-03T16:39:17+00:00",
  "projection_hash": "99a8906fe3fade134ae24af959e9a98c697dd5721ba4d3053c2b402fcbb4f57c",
  "rdx_source_sha": "d8140a25f8166bf0ca5ce5fc19f7cb1bd06a3d6d",
  "run_id": "smoke-atdd-corrected-d3-3-3",
  "rust_scope": true,
  "schema_version": "rdx-tea-run.v1",
  "tea_source_sha": "8734d51f24071ddbcb3617390b5fcddb4128ef77",
  "workflow": "atdd"
}